{
  "$schema": "../_schema/machine.schema.json",
  "kind": "stage",
  "id": "stage.systemic",
  "version": "1.0.0",
  "revision": 2,
  "title": "Systemic circulation — peripheral appearance & clearance",
  "status": "published",
  "updated": "2026-07-25",
  "order": 6,
  "provenance": {
    "basedOn": [
      "Standard physiology: peripheral glucose appearance shaped by gastric emptying, fiber and matrix; insulin-driven clearance back toward baseline. Teaching shape, not a personal reading."
    ],
    "sources": [
      "NIDDK - Your Digestive System & How It Works: https://www.niddk.nih.gov/health-information/digestive-diseases/digestive-system-how-it-works",
      "Hall & Hall, Guyton and Hall Textbook of Medical Physiology, 14th ed. - Unit XII, Gastrointestinal Physiology",
      "Boron & Boulpaep, Medical Physiology, 3rd ed. - The Gastrointestinal System"
    ],
    "authors": [
      "biology-as-code"
    ]
  },
  "inputs": [
    {
      "field": "meal.glucoseG",
      "unit": "g"
    },
    {
      "field": "meal.fiberG",
      "unit": "g"
    },
    {
      "field": "meal.matrixIntegrity",
      "unit": "0-1"
    },
    {
      "field": "host.insulinResistance",
      "unit": "0-1",
      "description": "Teaching proxy only - not a personal reading"
    }
  ],
  "startAt": "appearance",
  "states": {
    "appearance": {
      "type": "task",
      "label": "Peripheral glucose appearance",
      "detail": "Glucose that cleared the liver appears in peripheral blood - the CGM-like shape, driven by everything upstream (emptying rate, fiber, matrix). Teaching shape, not your meter.",
      "windowH": [
        0.75,
        2
      ],
      "requires": [
        {
          "field": "meal.glucoseG",
          "op": "exists"
        }
      ],
      "emits": [
        "glucose-curve"
      ],
      "next": "shapeChoice"
    },
    "shapeChoice": {
      "type": "choice",
      "label": "Curve shape",
      "detail": "Fast-emptying, low-fiber, refined loads produce a sharp rise; buffered whole-food meals produce a gentle one.",
      "choices": [
        {
          "when": {
            "all": [
              {
                "field": "meal.fiberG",
                "op": "<",
                "value": 8
              },
              {
                "field": "meal.matrixIntegrity",
                "op": "<",
                "value": 0.3
              },
              {
                "field": "meal.glucoseG",
                "op": ">=",
                "value": 30
              }
            ]
          },
          "next": "sharpRise",
          "note": "Unbuffered refined load -> steep appearance."
        }
      ],
      "default": "gentleRise"
    },
    "sharpRise": {
      "type": "task",
      "label": "Sharp rise",
      "detail": "Steep glucose appearance and a larger insulin response; a bigger post-peak dip is the teaching cost.",
      "edgeCases": [
        {
          "id": "insulin-resistance",
          "when": {
            "field": "host.insulinResistance",
            "op": ">=",
            "value": 0.5
          },
          "effect": "Higher, more prolonged elevation for the same load - the appearance clears more slowly.",
          "note": "Teaching context only."
        }
      ],
      "next": "clearance"
    },
    "gentleRise": {
      "type": "task",
      "label": "Gentle rise",
      "detail": "Blunted appearance, steadier energy, smaller insulin swing - the buffered whole-food shape.",
      "next": "clearance"
    },
    "clearance": {
      "type": "task",
      "label": "Insulin-driven clearance",
      "detail": "Insulin drives peripheral uptake and the curve returns toward baseline, closing the fed window.",
      "emits": [
        "return-to-baseline"
      ],
      "end": true
    }
  }
}
